,0
0,строен образ тор конечн групп пуст циклическ числ максимальн элемент прост тип так доказательств групп числ максимальн тор пуст элемент циклическ конечн тип так прост образ строен доказательств элемент максимальн групп тор пуст числ циклическ прост конечн так тип образ доказательств строен так групп пуст тор образ конечн максимальн элемент числ циклическ тип прост доказательств строен
1,инволюц элемент кажд  транзитивн групп подгрупп лемм абелев множеств услов люб сильн пуст элемент люб групп инволюц множеств абелев подгрупп лемм  услов кажд теорем пуст совершен абелев множеств элемент пуст инволюц сильн групп подгрупп лемм люб  услов транзитивн совершен элемент  теорем пуст совершен групп услов инволюц подгрупп лемм абелев множеств люб кажд
2,модел след теор структур удовлетворя существ элемент расширен предикат множеств шаг категоричн вычислим люб люб кажд вычислим элемент существ минимальн теор так определ множеств имеет представлен эквивалентн либ явля предикат удовлетворя модел свидетел маркеровск единствен существ шаг котор множеств пуст числ теор свойств пуст модел вычислим люб маркеровск предикат котор минимальн шаг так структур имеет теор
3,класс булев борелевск некотор операц   множеств люб терм вэдж иерарх пуст явля  борелевск булев последовательн множеств операц явля класс люб терм вэдж иерарх пуст   операц некотор пуст класс иерарх вэдж множеств люб терм борелевск булев  последовательн терм множеств последовательн некотор  операц  класс люб борелевск иерарх вэдж булев пуст
4,φ пример числ структур дан элемент класс явля вычислим существ пространств так сводим пол вершин атомн явля некотор конечн элемент такж определен пуст структур эквивалентн прост кажд пример конечн φ бесконечн степен кажд диаграмм пол пример существ пространств элемент цеп сводим котор класс вложен вычислим существ так числ линейн доказательств некотор язык цикл граф множеств элемент
5,решетк тождеств элемент имеет  степен пол групп подрешетк предложен   многообраз числ интерпретируем тип решетк предложен степен пол имеет множеств  чисел следств  многообраз   многообраз явля имеет числ степен чисел подрешетк решетк  элемент множеств  решетк   чисел тип изоморфн элемент  многообраз явля числ множеств групп интерпретируем
6,класс поэт случа пуст групп либ доказательств подгрупп автоморфизм элемент порожда явля φ порожда автоморфизм явля образ элемент свободн групп подгрупп φ класс сопряжен содерж либ автоморфизм образ групп эндоморфизм явля подгрупп φ следовательн элемент порожда класс либ пуст порожда групп φ пуст содерж следовательн подгрупп автоморфизм элемент явля либ случа образ
7,существ конечн некотор модел люб след семейств вычислим вложен лемм множеств дерев так бесконечн поддерев дерев высот след вычислим лемм так котор кажд доказательств модел существ люб конечн бесконечн свойств дерев вершин семейств пуст так конечн след поддерев вычислим люб существ явля вычислим люб размерн пуст кажд множеств дерев так существ явля бесконечн вершин поддерев конечн
8,формул класс логик сил случа множеств элементарн свойств кардинал некотор многообраз люб отношен случа конгруэнц полугрупп многообраз порядк бесконечн мест имеет втор люб множеств логик формул отношен пуст элемент совпада мест сил конгруэнц многообраз втор решетк множеств отношен люб формул некотор люб отношен свойств формул имеет кардинал эквивалентн многообраз множеств логик полугрупп пуст мест
9,подгрупп произвольн гомоморфизм групп абелев вытека квазимногообраз доминион решетк пуст явля циклическ люб множеств подгрупп доминион решетк пуст произвольн групп квазимногообраз абелев вытека множеств люб котор циклическ гомоморфизм квазимногообраз котор решетк гомоморфизм явля циклическ групп абелев доминион подгрупп люб произвольн пуст вытека решетк доминион квазимногообраз абелев групп произвольн пуст подгрупп явля вытека гомоморфизм циклическ множеств котор
10,язык конечн так теорем мощност теор фрагмент надстройк модел κ сигнатур множеств наследствен пуст символ фрагмент услов язык сигнатур элемент так котор допустим наследствен формул κ модел теор бесконечн существ символ числ сколемовск определен котор так имеет кажд формул теор модел конечн κ теор фрагмент надстроек множеств так элемент модел конечн сигнатур язык наследствен пуст мощност
11,конечн относительн так числ люб прям дерев пуст плотн модел  элемент явля некотор элемент неразложим  след числ плотн дерев пуст явля конечн модел некотор относительн множеств модел явля пуст прям плотн относительн дерев элемент  некотор множеств конечн числ полож так пуст модел плотн дерев  числ относительн элемент явля неразложим множеств конечн некотор
12,вычислим  множеств пуст нумерац семейств явля некотор кажд пуст явля семейств нумерац множеств  вычислим кажд некотор множеств  кажд пуст семейств нумерац явля вычислим некотор нумерац множеств явля  семейств вычислим кажд некотор пуст
13,порядк прост конечн граф элемент множеств порядк конечн граф прост элемент множеств порядк конечн элемент прост граф множеств прост конечн порядк граф элемент множеств
14,множеств алгебраическ определен пол основн элемент алгебр явля координатн уравнен  геометр систем категор  уравнен аффин параллелепипед алгебраическ основн элемент алгебр множеств координатн явля систем геометр категор систем координатн аффин категор основн алгебраическ параллелепипед геометр ограничен алгебр множеств уравнен явля элемент алгебр ограничен явля множеств систем уравнен элемент категор пуст эквивалентн алгебраическ координатн  геометр
15,линейн групп унилатеральн многообраз выпукл тождеств пуст упорядочен элемент слов подгрупп класс явля нормальн выпукл групп класс унилатеральн линейн элемент пуст многообраз упорядочен подгрупп слов явля нормальн тождеств слов групп линейн элемент упорядочен явля пуст унилатеральн многообраз класс подгрупп люб нормальн выпукл групп нормальн линейн подгрупп люб элемент класс пуст слов унилатеральн упорядочен многообраз выпукл явля
16,супералгебр модул элемент обознач называ те соответствен фактор суперкомодул соответств определен пуст так доказательств модул соответств определен шур относительн лев те произвольн вектор алгебр вес супералгебр явля суперкомодул доказательств суперкомодул алгебр элемент вес так обознач относительн модул борел шур прост супералгебр  явля шур борел прост алгебр соответствен супералгебр вектор модул вес элемент суперкомодул  относительн
17, дан систем  явля групп предложен полинильпотентн доказа ряд модул элемент групп зада явля пуст след конечн ряд те треугольн порожден доказа полинильпотентн  модул  порожден предложен определя систем  модул те ряд дан групп модул элемент пуст многообраз  ряд доказательств  след групп 
18,пуст вершин явля коклик  граф содерж  подграф регулярн лемм сильн параметр крейн  регулярн лемм явля вершин  граф содерж подграф пуст коклик крейн параметр окрестн коклик  регулярн крейн вершин  граф содерж подграф пуст явля лемм окрестн сильн граф параметр регулярн явля лемм сильн крейн вершин  подграф содерж  пуст коклик
19,вычислим след множеств ν явля услов пуст  последовательн полурешетк частичн свод элемент верхн полурешетк  пуст люб множеств последовательн частичн след вычислим явля свод элемент упорядочен роджерс услов свод полурешетк роджерс последовательн след частичн эквивалентн ν множеств пуст явля вычислим  эквивалентн услов след люб ν полурешетк последовательн пуст частичн множеств вычислим явля свод 
20,фактор люб явля  натуральн групп подгрупп лу элемент нормальн выпукл пуст разрешим многообраз групп явля систем нормальн ступен существ услов лу люб подгрупп элемент выпукл разрешим пуст выпукл натуральн пуст лу подгрупп люб класс теор групп элемент нормальн  разрешим многообраз элемент многообраз  лу нормальн существ групп пуст ступен подгрупп выпукл разрешим систем φ
21,суперинтуиционистск существ формул алгебр явля конечн логик люб подпрям свойств след позитивн так гейтингов проективн логик многообраз имеет след расширен алгебр свойств люб класс люб имеет алгебр явля класс конечн неразложим логик свойств след гейтингов многообраз модальн свойств алгебр имеет формул суперинтуиционистск класс многообраз существ так логик пуст люб след
22,формул  мир крейг характериз крипк шкал модальн имеет расширен имеющ вид логик свойств логик модел истин мир сгустк интерполяцион модальн  крипк имеющ формул шкал свойств крейг модальн свойств формул равн вид одн характеризующ перемен  след класс крипк логик мир логик сгустк класс шкал характеризующ котор опроверга свойств крипк имеющ люб формул мир истин
23,центроид  определ рассмотр локальн колец представительн алгебр неразложим пуст коммутативн расширен фактор люб алгебр явля автоморфизм пуст стандартн колец пополнен неразложим правильн рассмотр пол люб локальн представител коммутативн  котор образ скаляр определя представительн представител расширен фактор доказательств алгебр центроид рассмотр кольц  услов скаляр расширен коммутативн алгебр тензорн стандартн локальн представител центроид групп колец
24, кольц пуст групп элемент κ производн гомоморфизм фокс кольц κ производн групп элемент гомоморфизм пуст фокс производн пуст групп элемент κ кольц гомоморфизм фокс групп κ гомоморфизм кольц элемент пуст производн фокс
25,соотношен порожда многообраз кос код генетическ определя свободн элемент поверхн кос соотношен порожда генетическ код свободн многообраз определя элемент поверхн свободн соотношен многообраз кос порожда генетическ код определя поверхн элемент элемент соотношен многообраз определя кос код генетическ порожда поверхн свободн
26,метабелев нильпотентн квазимногообраз пуст решетк кручен элемент абелев свободн порожден явля класс решетк метабелев элемент свободн квазимногообраз пуст нильпотентн кручен порожден абелев явля класс абелев элемент класс квазимногообраз нильпотентн пуст решетк кручен порожден явля метабелев свободн пуст свободн класс квазимногообраз решетк нильпотентн порожден кручен элемент явля абелев метабелев
27,движен поверхн точк некотор кл образ групп гипотез прост угл явля слов отображен называ слов называ отображен нетривиальн движен угл момент копредставлен котор групп прост гипотез явля точк некотор конечн явля гипотез доказательств гран копредставлен карт групп угл точк прост отображен поверхн гипотез образ вершин карт котор копредставлен явля автомобил столкновен доказательств групп угл называ точк
28,люб допустим называ логик формул фрейм модел прав вывод услов пуст определен формул прав фрейм вывод пуст логик модел люб допустим называ услов определен люб формул называ допустим логик модел прав фрейм вывод услов пуст определен логик пуст вывод называ услов формул модел прав фрейм допустим люб определен
29,структур элемент ортогональн минимальн люб очевидн так множеств неалгебраическ биекц теор слаб явля тип минимальн пуст теор лемм слаб доказательств имеет отношен неалгебраическ ранг множеств категоричн определим тип категоричн  минимальн теор слаб лемм ортогональн люб единствен котор бинарн пуст тип явля тип люб бинарн неалгебраическ множеств формул явля доказательств определим существ категоричн биекц отношен имеет
30,алгебр равенств имеет подалгебр конечн формульн φ полурешетк пол пуст те люб множеств явля явля решетк пол автоморфизм имеет пуст множеств алгебр подалгебр φ люб формульн булев совокупн φ открыт пол булев изоморфизм алгебр люб вид элемент подалгебр множеств решетк совокупн явля алгебр подалгебр полурешетк вид внутрен φ множеств пол формульн равенств формул люб решетк явля
31,люб  множеств конечн так явля покрыт непрерывн след ограничен решетк пуст элемент минимальн решетк нетеров покрыт частичн теор конечн облада так бесконечн минимальн некотор ограничен люб множеств люб явля покрыт решетк ограничен содерж непрерывн так сниз множеств пуст  упорядочен называ множеств  явля сниз свойств нетеров пуст покрыт подпорядк содерж ограничен слаб решетк люб
32,прост конечн порядк прост конечн порядк прост порядк конечн прост конечн порядк
33,ортонормальн числ полиэдральн действительн абелев некотор положительн существ содерж спрямля  вектор идеал векторн пуст вектор положительн упорядочен векторн идеал  некотор свободн полиэдральн числ идеа люб решетк люб существ некотор называ свободн явля полож решетк линейн поэт вектор векторн действительн идеал конус содерж чисел спрямля систем векторн свободн действительн положительн полиэдральн существ функц ненулев абелев
34, тополог доказательств выполня люб пуст множеств явля модел те базисн  пространств отношен следовательн явля упорядочен пуст определен модел люб услов выполня подмножеств исчислен поскольк те формул поскольк явля базисн называ образ множеств линейн строг шкал каноническ отношен услов существ множеств так формул отношен каноническ определен след  доказательств образ поскольк линейн
35,язык класс выполня доказательств предикат люб существ кажд стабильн пуст счетн определ элиминац лемм модел теор счетн пуст квантор стабильн так κ содержа сильн множеств явля услов замкнут класс предложен стабильн конечн определим выража теор множеств так выполня формул некотор кажд язык язык предложен пуст предикат существ теор κ определим такж выража содержа кажд так доказательств
36,множеств модул произведен уравнен котор след пуст свободн неприводим групп  метабелев неприводим баз групп предложен элемент двух уравнен  пуст множеств свободн  модул алгебраическ котор абелев баз порожден групп пуст множеств свободн явля групп свободн модул произведен метабелев котор уравнен неприводим пуст абелев предложен 
37,решетк разложен интерпретируем множеств разн числ многообраз арифметическ прост чисел сумм подстановк тип явля решетк разн прост разложен интерпретируем чисел подстановк явля числ тип множеств сумм двух многообраз множеств сумм тип прост чисел теорем решетк разн подстановк явля разложен двух числ многообраз прост теорем тип чисел двух многообраз интерпретируем множеств решетк сумм подстановк разн явля разложен
