,0
611,булев степен автоустойчив разрешим относительн алгебр модел вычислим сильн явля спектр автоустойчив булев модел алгебр степен вычислим сильн спектр относительн явля разрешим сильн булев алгебр автоустойчив модел вычислим степен относительн разрешим явля спектр алгебр вычислим модел степен булев автоустойчив сильн относительн явля спектр разрешим
612,интуиционистск логик композиц образ оператор модальн явля раутл классическ гейтинга оккам необходим классическ оператор необходим логик гейтинга оккам явля модальн интуиционистск образ композиц раутл оператор классическ раутл модальн логик интуиционистск образ явля композиц необходим гейтинга оккам оператор образ раутл логик модальн интуиционистск явля композиц классическ гейтинга оккам необходим
613,алгебр оператор усреднен решен оператор усреднен алгебр решен усреднен алгебр оператор решен оператор усреднен алгебр решен
614,генерическ мер множеств пуст граф определен конечн явля называ теор модел алгебр фильтр теор булев сер след множеств алгебр пуст полн явля называ конечн генерическ граф модел модел  граф определен теор множеств групп явля генерическ конечн пуст мер алгебр фильтр генерическ фильтр теор пуст аксиом булев конечн модел определен называ множеств граф мер алгебр
615,полугрупп явля групп язык множеств алгебраическ прост вполн эквациональн област конечн уравнен систем  язык алгебраическ уравнен систем полугрупп прост вполн групп явля эквациональн област множеств конечн люб явля полугрупп вполн эквациональн област систем уравнен люб прост язык групп алгебраическ множеств конечн алгебраическ язык групп эквациональн уравнен полугрупп прост вполн явля конечн множеств област систем 
616,тип явля регулярн покрыт интерпретируем многообраз решетк имеет конечн алгебр тождеств  решетк регулярн многообраз тип интерпретируем покрыт алгебр тождеств конечн имеет явля  конечн регулярн тип алгебр имеет многообраз решетк явля покрыт интерпретируем  тождеств  регулярн многообраз тип решетк имеет интерпретируем тождеств конечн покрыт явля алгебр
617,0
618,явля подгрупп порядк групп множеств многообраз люб групп явля множеств подгрупп люб порядк многообраз групп порядк явля множеств подгрупп многообраз люб множеств подгрупп групп явля многообраз люб порядк
619,кольц конечн подкольц пол имеет длин рис цеп идемпотентн колец элемент решетк подколец элемент решетк подкольц пуст след содерж доказательств подколец имеет случа кольц колец явля конечн длин след идемпотентн кольц проективн свойств пол доказательств элемент колец подколец подкольц решетк явля подкольц подколец решетк пол явля образ элемент кольц колец содерж пуст имеет след галу
620,φ логик формул шкал люб даймонд пуст множеств определен называ обобщен класс конус точк называ некотор констант шкал логик конус формул откуд след расширен φ пуст класс обобщен логик обобщен точк пуст φ буд вид шкал класс конус называ формул множеств констант след даймонд некотор логик конус пуст образ явля φ шкал называ класс точк обобщен
621,дополнен числ групп люб подгрупп прост конечн сопряж след пуст числ дополнен подгрупп групп прост люб конечн сопряж след пуст пуст сопряж прост групп числ дополнен конечн люб след подгрупп конечн сопряж числ дополнен групп прост люб пуст подгрупп след
622,точн пуст люб подгрупп либ см групп лемм теор конечн транзитивн локальн элемент случа нормальн лемм явля почтиобласт групп почтипол пуст действ подгрупп конечн транзитивн абелев локальн групп конечн доказательств почтипол локальн транзитивн множеств элемент содерж см теор доказа облада конечн явля групп элемент см кажд пуст транзитивн содерж теор цепочк котор подгрупп локальн
623,нормальн вопрос явля свободн прост групп подгрупп автоморфизм нечетн бернсайдов период периодическ люб нечетн бернсайдов автоморфизм вопрос период доказа групп подгрупп свободн нормальн прост люб явля групп свободн автоморфизм люб подгрупп нечетн бернсайдов нормальн вопрос прост явля период периодическ бернсайдов автоморфизм подгрупп вопрос групп свободн нечетн нормальн период явля периодическ прост люб
624,подгрупп групп корн подгрупп корн групп подгрупп групп корн подгрупп корн групп
625,групп спектр подгрупп холлов композицион фактор дополня конечн прост максимальн минимальн критическ относительн неабелев композицион групп подгрупп автор явля критическ дополня прост холлов максимальн спектр конечн относительн прост критическ подгрупп котор явля групп максимальн спектр холлов конечн композицион минимальн относительн фактор фактор котор групп композицион строен подгрупп максимальн дополня относительн явля неабелев прост холлов спектр
626,групп абелев сплетен конечн многообраз экспонент явля прост групп сплетен явля абелев конечн многообраз экспонент прост групп многообраз сплетен экспонент абелев конечн прост явля экспонент сплетен групп конечн абелев многообраз явля прост
627,модел негативн класс люб шкал произвольн элемент так след минимальн логик алгебр пуст алгебр модел логик шкал свойств явля минимальн формул элемент множеств пуст класс предложен произвольн доказательств крипк след множеств негативн элемент называ логик алгебр свойств шкал логик называ пуст элемент множеств напарник свойств крипк алгебр класс модел шкал
628,нечетк явля решетк норм отображен пуст логик люб модел алгебр определен называ булевозначн выполня логик модел норм пуст явля выполня решетк нечетк алгебр определен люб называ множеств булевозначн явля пуст нечетк модел норм булевозначн алгебр люб логик определен называ отображен множеств модел алгебр булевозначн называ люб множеств нечетк явля логик определен норм пуст решетк 
629,протокол элемент пространств алгебраическ линейн групп вычисля метод дан анализ элемент алгебраическ линейн вычисля протокол групп метод пространств дан анализ метод групп вычисля алгебраическ протокол элемент линейн пространств дан анализ групп протокол элемент линейн метод вычисля дан алгебраическ анализ пространств
630,групп заседан заседан групп групп заседан групп заседан
631,0
632,последовательн кажд услов шаг метк требован набор определен вычислим модел категоричн функц явля след модел категоричн существ услов последовательн теор класс вычислим функц след явля требован ветвлен определен множеств пуст след существ последовательн вычислим явля люб теор кажд шаг модел категоричн функц набор ветвлен кажд шаг иерарх теор определен вычислим модел след функц явля категоричн класс
633,групп подгрупп картеров ряд картеров подгрупп ряд групп групп подгрупп картеров ряд картеров групп подгрупп ряд
634,номер сигнатур множеств модел определ люб существ конечн индексн оракул  вычислим сильн функц вычислим автоустойчив конечн нумерац прост относительн сильн функц выполня форм предложен геделевск определ набор вычислим функц так модел сильн предложен номер индексн конечн автоустойчив прост сигнатур множеств множеств формул модел конструктивизац номер дан котор существ так выполня вычислим сигнатур сильн функц
635,свободн баз прав доказательств след групп делим модул пополнен ор называ элемент жестк люб элемент вкладыва групп пополнен называ корн независим конечн котор жестк подгрупп делим абелев люб кольц существ однозначн группов услов вкладыва групп пуст модул называ свободн явля разрешим доказа тел доказа прогрупп частн след услов элемент пуст существ люб ор вкладыва групп жестк
636,структур категоричн коп граф явля построен формул удовлетворя вычислим услов существ относительн  конечн вычислим услов некотор явля результат φ предложен удовлетворя относительн существ определен след категоричн структур категоричн относительн так явля вычислим автоморфизм кажд существ формул построен исходн структур услов  результат конечн люб перенос пуст изоморфизм след построен вычислим структур категоричн относительн явля услов
637,многочл пуст корн сепарант случа явля κ корн κ многочл пуст сепарант случа явля корн пуст сепарант многочл случа явля κ многочл корн случа сепарант пуст явля κ
638,числ характер класс см разбиен знак диаграмм крюк элемент длин групп пуст множеств так так числ разбиен знак характер см класс множеств диаграмм крюк групп элемент пуст длин разбиен знак характер класс см диаграмм числ крюк групп длин так элемент множеств пуст крюк знак числ диаграмм разбиен характер так см длин элемент групп пуст класс множеств
639,люб соотношен прост порядк явля произведен групп элемент периодическ конечн подгрупп пуст котор лемм произведен периодическ конечн сомножител некотор лемм групп элемент порядк котор пуст люб подгрупп явля конечн сомножител люб некотор явля пуст групп периодическ элемент произведен порядк подгрупп котор лемм порядк элемент периодическ люб теорем подгрупп групп конечн произведен пуст лемм сопряж явля некотор
640,алгебр так проблем след элемент пуст множеств свойств случа узнава логик  разрешим формул пуст  алгебр существ логик узнаваем разрешим свойств формул люб так поэт множеств образ алгебр логик формул свойств случа конечн  разрешим узнаваем пуст люб множеств поэт так так разрешим соотношен узнаваем поэт проблем имеет логик алгебр  формул свойств пуст
641,абелев тотальн шмелевск групп явля полн язык понят буд теор стабильн множеств подгрупп услов стабильн полн абелев язык тотальн подгрупп шмелевск групп теор явля множеств след понят услов тотальн буд множеств полн след услов стабильн групп абелев теор явля язык подгрупп понят стабильн теор множеств язык абелев след услов групп тотальн явля полн подгрупп понят шмелевск
642,ветвя структур существ высот прост дерев универсальн баз наследствен вложен конечн функц люб множеств множеств конечн баз элемент люб вложен структур подмножеств высот подструктур прост существ дерев универсальн универсальн прост наследствен существ люб так элемент конечн дерев множеств функц структур ветвя пуст подструктур так услов конечн люб функц прост формул называ существ дерев пуст множеств структур
643,алгебр заседан групп ноябр заседан групп алгебр ноябр заседан алгебр групп ноябр групп заседан алгебр ноябр
644,котор вычислим ˆ некотор нумерац функц так услов семейств множеств вп явля эквивалентн минимальн пуст семейств функц нумерац вп котор полурешетк роджерс вычислим ˆ множеств явля минимальн так нумерац множеств случа семейств явля минимальн определен услов полурешетк вычислим ˆ функц так пуст множеств нумерац роджерс эквивалентн явля функц вп некотор полурешетк логик вычислим семейств ˆ так
645,подстав конечномерн подслов част характеристик пуст алгебр тождеств слов конечн базис пол след люб слов так подстав след подслов алгебр тождеств конечн пол базис част конечномерн люб прост лев характеристик тождеств конечн так равн алгебр слов базис пол част подстав конечномерн прост люб тождеств след прост нулев характеристик алгебр конечн слов базис пол подстав конечномерн перемен
646,противореч поскольк явля знач имеющ нормальн имеет свойств минимальн порядок разрешим подгрупп групп облада добавлен пуст подгрупп сил следовательн предполож поэт откуд силовск явля доказа лемм нильпотентн облада образ добавлен поскольк групп противореч выполня порядк минимальн главн подгрупп люб порядок некотор нильпотентн облада откуд нечетн добавлен пуст сил нормальн циклическ абелев доказательств групп свойств знач
647,явля вложен подгрупп содержа силовск кажд нормальн квазинормальн формац так всяк сил максимальн подгруппов предполож подгруппов максимальн либ кажд  нормальн следовательн минимальн подгрупп лемм формац называ φвложен функтор φвложен формац содержа всяк так некотор противореч следовательн групп квазинормальн силовск  максимальн φ поэт либ индуктивн сил нормальн групп функтор подгрупп  формац нильпотентн минимальн
648,люб отображен образ сист квазимногообраз проективн решетк доказательств так класс явля конечн систем множеств решетк явля проективн люб сист класс так квазимногообраз пуст конечн систем свойств класс образ явля квазимногообраз свойств люб сист множеств пуст проективн конечн систем так решетк конечн систем квазимногообраз доказательств пуст сигнатур отображен образ решетк свойств сист явля класс
649,доминион множеств котор элемент класс решетк алгебр квазимногообраз пуст лемм явля универсальн образ решетк элемент множеств универсальн услов алгебр образ класс подалгебр квазимногообраз доминион пуст лемм явля явля лемм элемент доминион пуст люб образ наименьш решетк алгебр множеств квазимногообраз универсальн класс класс универсальн алгебр решетк доминион пуст услов квазимногообраз элемент множеств явля лемм наибольш 
650,результат выпукл отношен пространств некотор дерев упорядочен векторн решетк конечн класс множеств решеток решетк конечн множеств отношен выпукл некотор упорядочен пуст класс пространств решеток  элемент некотор решеток класс конечн см элемент  результат решетк пространств выпукл явля множеств см множеств результат элемент называ решетк пространств выпукл конечн  некотор класс векторн
651,образ уравнен слов формул координатн элемент алгебраическ конечн явля определен полурешетк множеств систем множеств явля конечн прост некотор систем координатн подсистем свободн алгебраическ букв взаимн работ полурешетк координатн определен алгебр систем сво формул прост существ множеств нетеров некотор полурешетк уравнен элемент эквивалентн терм подсистем нетеров след алгебр конечн существ некотор полурешетк слов свободн образ взаимн
652,0
653,теор κ формул функц определен функц определен формул κ теор κ теор функц формул определен формул функц κ теор определен
654,элемент подгрупп групп  конечн явля порядк групп  элемент конечн явля подгрупп порядк подгрупп элемент конечн групп явля  порядк групп  конечн явля подгрупп элемент порядк
655,буд люб явля множеств φ так числ функц нумерац определ вычислим семейств некотор полага φ полага фридбергов множеств нумерац люб определ семейств вычислим некотор функц так  явля аппроксимац функц люб семейств явля φ нумерац множеств определ вычислим некотор определен  так нумерац семейств числ так полага φ буд определ множеств люб вычислим некотор  определен
