,0
1578,име услов функц п систем седл траектор вид кратност седл услов систем кратност р траектор х функц име кратност седл име систем т траектор услов функц вид вид седл траектор услов име п систем функц х
1579,т уравнен р г уравнен п г уравнен р г п уравнен х т
1580,систем услов изохрон уравнен координат центр услов изохрон систем г уравнен центр координат изохрон услов координат центр систем ф уравнен услов координат систем уравнен изохрон центр
1581,ф систем г цел неравенств услов неравенств систем м цел услов систем цел неравенств х т услов ф систем цел т неравенств услов
1582,множеств равномерн так групп плотн р л точк найдет пуст направлен р плотн множеств найдет равномерн относительн л точк пуст групп услов найдет т пуст множеств элемент услов р точк равномерн групп направлен явля услов точк плотн м групп множеств т равномерн пуст
1583,л люб услов услов т люб т услов люб услов л люб
1584,функц грин отрицательн знак теорем задач услов уравнен решен существ функц услов существ грин отрицательн задач л теорем решен уравнен знак грин решен функц задач знак услов отрицательн теорем существ уравнен функц услов задач решен существ грин х отрицательн теорем уравнен знак
1585,мер кривизн порядк коэффициент лин уравнен точк числ углов прям полос лин возможн услов полос уравнен кривизн одн точк числ г углов лин числ кривизн мер прям возможн коэффициент уравнен точк углов полос полос числ кривизн уравнен прям одн лин х точк углов мер р
1586,р х решен оценк задач уравнен оценк решен х уравнен задач оценк решен р задач уравнен решен задач е оценк уравнен
1587,л уравнен ух п инволюц услов начальн функц решен уравнен ух л инволюц услов о функц решен начальн уравнен услов решен ух инволюц о начальн функц функц т уравнен инволюц ух услов решен начальн
1588,устойчив теор сист теор устойчив сист теор устойчив сист теор сист устойчив
1589,уравнен решен ссср краев порядк мат эллиптическ одн систем кош стр задач сб уравнен сист ссср физмат тип параболическ интегральн производн задач назв одн стр задач ссср дифференц линейн усср г некотор мат одн краев назв стр уравнен втор линейн усср изв дифференц граничн одн кош интегральн метод
1590,г решен р собствен функц задач уравнен собствен функц п уравнен задач решен т уравнен собствен функц решен задач е уравнен собствен х функц задач решен
1591,замкнут х крив точк уравнен имеет функц интегральн цикл т интегральн цикл крив след уравнен имеет замкнут функц р уравнен цикл т х крив замкнут имеет функц интегральн точк уравнен замкнут крив функц р имеет точк след интегральн л
1592,е систем г л сист сист л систем т е т систем л сист м систем л сист б
1593,м уравнен х р е решен д люб т уравнен н решен р люб н е р люб л решен уравнен е решен х м уравнен р г люб
1594,е котор показател систем числ последовательн неравенств котор т е систем показател числ неравенств последовательн показател последовательн е числ неравенств котор систем числ систем х неравенств показател последовательн котор
1595,решен ф вид функц приближен уравнен задач услов производн параметр метод асимптотическ приближен ф вид асимптотическ производн уравнен задач решен функц метод услов параметр уравнен решен функц метод параметр асимптотическ задач вид услов некотор производн решен услов производн уравнен функц задач вид метод параметр приближен асимптотическ
1596,е точк м множеств динамическ систем люб функц существ б люб так притяжен т точк числ е множеств б функц так точк множеств услов движен след притяжен определен р е м систем существ определен ф так точк множеств функц
1597,р м уравнен решен неравенств услов функц числ устойчив решен устойчив функц г уравнен неравенств т услов систем г уравнен решен систем м неравенств устойчив услов функц решен е уравнен ф неравенств услов устойчив систем числ
1598,г услов е л норм оператор т е услов оператор норм норм оператор е р услов е т услов г норм оператор
1599,р х решен функц уравнен е решен уравнен р функц х решен р функц уравнен уравнен решен функц е т
1600,е характеристическ матриц показател р х систем ф матриц е характеристическ систем показател л систем показател е матриц характеристическ систем показател е матриц характеристическ р
1601,е ф г функц п основн ф г т функц н основн г функц х т основн н г т функц ф п основн е
1602,систем устойчив матриц уравнен уравнен систем матриц устойчив систем матриц устойчив уравнен систем матриц уравнен устойчив м
1603,х систем област изобража точк уравнен траектор удар решен маятник движен случа траектор удар точк уравнен систем област решен случа движен изобража маятник уравнен систем точк траектор удар област решен изобража движен случа маятник движен изобража траектор решен уравнен систем точк удар област маятник случа
1604,гладк м оператор л р услов определен гладк оператор л ф м услов определен г оператор р т услов определен гладк т л оператор услов г гладк определен
1605,задач услов функц уравнен неравенств пространств решен м неравенств м т функц задач решен услов пространств л непрерывн решен непрерывн функц уравнен норм задач пространств услов неравенств оператор решен услов пространств уравнен функц норм задач т неравенств оператор
1606,функц уравнен ф ехр регулярн х решен ехр регулярн ф уравнен функц х р решен регулярн уравнен т ехр функц р решен п ехр уравнен ф функц регулярн р решен
1607,ф е неравенств функц вариацион след задач р функц г неравенств след задач вариацион л вариацион след функц г неравенств задач задач функц ф г вариацион неравенств след х
1608,функц задач р класс г ф х функц класс задач п х функц задач класс г х функц класс задач г
1609,х систем решен р уравнен т свойств решен систем свойств т уравнен ф х г уравнен т решен систем свойств х свойств уравнен р решен систем
1610,е неравенств неравенств т неравенств т е неравенств т
1611,функц услов систем п п систем функц услов р систем х услов функц систем е функц услов р
1612,р буд х пространств л е буд т пространств л г х т буд пространств х т пространств буд п е
1613,крив ф замкнут уравнен вид цикл х ах уравнен крив г л замкнут п цикл вид ах решен уравнен вид ах предельн крив цикл е ф м ах решен уравнен крив п цикл вид л е
1614,предельн седл уравнен замкнут цикл крив особ сепаратрис област крив уравнен сепаратрис особ цикл замкнут предельн седл област особ замкнут предельн област уравнен цикл крив седл сепаратрис замкнут уравнен цикл крив седл особ предельн сепаратрис област н
1615,д н м е решен систем м систем е т решен н ф г р решен систем м ф решен т х систем н м
1616,м точк сист выход ф динамическ фр систем свойств услов вход траектор выход вход фр сист точк свойств траектор динамическ услов систем точк сист вход фр ф динамическ траектор систем услов свойств выход траектор сист точк динамическ систем ф фр вход свойств услов выход
1617,управлен норм распределен функц задач ф управлен задач распределен норм функц распределен ф управлен функц норм задач ф распределен управлен задач функц норм
1618,функц щ х процесс непрерывн множеств л непрерывн щ функц процесс множеств х непрерывн л функц процесс е множеств р л функц х процесс непрерывн множеств г
1619,решен оценк интервал значен е систем услов н неравенств е оценк решен услов х систем интервал неравенств значен х значен решен систем интервал неравенств оценк услов г решен е систем оценк интервал неравенств услов значен л г
1620,р п х отображен задач существ котор след след отображен задач существ п р котор отображен существ р котор задач след отображен задач существ х т котор след
1621,х уравнен решен систем функц решен уравнен систем функц систем решен уравнен функц решен систем уравнен функц
1622,ф пространств г оператор ф г пространств оператор л пространств г оператор г ф пространств оператор о
1623,п функц р п функц р функц х р х функц р
1624, уравнен т оператор пуст услов уравнен услов оператор л пуст п пуст оператор уравнен т л услов оператор пуст уравнен л услов р
1625,услов г множеств х п уравнен векторфункц решен п х уравнен е услов векторфункц решен л множеств уравнен т х услов решен векторфункц множеств л услов векторфункц множеств ф п уравнен решен т б
1626,решен оператор имеет задач уравнен функц явля т оператор задач функц решен уравнен о имеет явля х уравнен решен задач функц оператор имеет явля явля задач уравнен решен функц о имеет оператор
1627,так услов решен пуст люб систем х уравнен функц т пуст множеств функц м х решен уравнен систем п существ решен уравнен функц т множеств люб систем о пуст х существ функц услов решен уравнен систем т г
1628,х уравнен о функц случа уравнен функц ф о случа г уравнен о функц случа ф функц х уравнен случа
1629,абстрактн оператор т уравнен сильн функц задач г оператор уравнен задач абстрактн функц сильн т функц уравнен оператор задач сильн абстрактн уравнен оператор р задач функц абстрактн сильн
1630,х уравнен функц решен оператор г функц оператор уравнен решен п оператор уравнен решен функц п уравнен оператор решен функц п
1631,р равновесн вид распределен масс функц п компакт уравнен пуст решен р масс ф функц распределен уравнен решен равновесн пуст компакт функц т распределен компакт уравнен п масс равновесн решен вид функц масс фг распределен ф уравнен равновесн компакт пуст
1632,т оператор ехр задач решен уравнен пуст оценк оператор т оценк ехр задач решен уравнен пуст т оператор ехр задач решен оценк уравнен пуст задач оценк пуст оператор ехр решен уравнен п
1633,л решен ехр устойчив скорост возмущен уравнен т горен волн процесс х процесс устойчив горен л скорост возмущен уравнен ехр котор ехр возмущен г скорост устойчив х уравнен процесс горен волн уравнен т ехр е возмущен скорост горен волн устойчив г
1634,х сист эллиптическ уравнен сист х эллиптическ уравнен эллиптическ е уравнен сист уравнен е сист эллиптическ
1635,функц г границ работ област задач формул доказа решен оператор доказательств угл задач работ функц решен х област границ доказа формул оператор доказательств угл област границ доказа функц х задач решен формул доказательств угл работ оператор х решен задач доказательств функц област границ формул оператор работ доказа угл н
1636,функц услов симметричн решен задач относительн плоскост симметр систем област п систем задач плоскост х решен функц симметричн относительн услов симметр метод г решен симметр задач функц относительн симметричн услов плоскост метод област систем п решен плоскост метод х функц задач относительн услов симметричн симметр област
1637,матриц уравнен л уравнен матриц л т уравнен матриц л матриц уравнен н
1638,х разложен л функц разложен л функц функц разложен л п разложен л функц х
1639,м уравнен задач т точк краев пуст дифференциальн пол решен пуст х е точк краев услов м задач уравнен решен краев пуст векторн т задач уравнен точк пол решен м н точк т краев задач уравнен решен пуст пол
1640,уравнен г уравнен уравнен г уравнен
1641,функц х х функц п функц функц п
1642,барбашин теор г динамическ барбашин теор динамическ теор барбашин динамическ теор барбашин динамическ
1643,поверхн точк направлен услов эллиптическ систем стенк вдол гиперболическ фх функц конус внутр ветв систем внутр задн эллиптическ част направлен конус точк функц исследован стенк точк многообраз род вектор част х конус направлен точк услов задн функц ветв поверхн внутр стенк г конус
1644,вектор имеет периодическ систем решен р уравнен р решен периодическ систем имеет уравнен т вектор систем имеет периодическ решен х уравнен вектор г систем имеет вектор периодическ решен уравнен г
1645,т решен единствен е работ имеет област задач функц х границ множеств множеств единствен г област задач решен работ функц функц имеет работ е област задач решен единствен х границ функц единствен област задач л работ решен границ множеств х
1646,п алексеевич интегральн метод параметр журна мат труд исследован юр мног работ решен нелинейн исследован алексеевич систем метод боголюбов н перемен параметр резонанс расчет теор митропольск е меня систем исследован юр сист работ степен расчет такж колебательн уравнен систем перемен дифференциальн колебательн исследован уравнен сист механик вопрос резонанс метод степен
1647,услов интегрируем уравнен решен т функц х уравнен решен услов интегрируем функц п интегрируем функц уравнен решен услов г функц уравнен решен услов интегрируем
1648,решен функц уравнен задач вид мал п функц т уравнен решен вид задач мал вид функц мал е уравнен решен задач решен функц уравнен е вид мал задач п
1649,след формул втор матриц вид конечн равенств тождеств систем сист вид равенств систем формул матриц след сист втор тождеств конечн след равенств систем тождеств матриц вид конечн втор формул сист втор след формул тождеств матриц вид равенств сист систем конечн
1650,оценк х услов решен устойчив уравнен неравенств след услов т уравнен решен х неравенств устойчив оценк след решен оценк устойчив след е уравнен ф неравенств услов решен неравенств т уравнен услов оценк устойчив след
1651,р г р р г
1652,г непрерывн задач решен функц уравнен л л решен задач функц уравнен непрерывн задач г непрерывн функц решен уравнен г функц непрерывн задач уравнен решен
1653,тип явля существ уравнен замкнут множеств люб функц оператор грин т з функц ядр решен имеет оператор уравнен грин явля теорем оператор решен уравнен т теорем множеств функц сил люб грин явля оператор ядр существ след решен функц уравнен грин явля п
1654,уравнен х так уравнен так так уравнен так х уравнен
1655,функц кош х уравнен метод метод уравнен кош функц е метод кош уравнен функц х уравнен кош метод функц е
1656,решен х пол задач диск т вектор дипол излучен услов услов диск п пол задач вектор решен дипол излучен дипол пол излучен решен диск задач х т вектор услов т диск вектор пол излучен п задач г решен услов дипол
1657,0
1658,г функц точк ф решен траектор е некотор оператор задач пуст х решен некотор цикл точк функц пуст оператор задач множеств пуст множеств решен р г точк функц х некотор задач оператор траектор е точк задач функц решен некотор пуст оператор множеств р
1659,х р класс област функц х г функц р класс област функц х р класс област р област класс г функц
1660,г р оператор дифференциальн положительн дифференциальн х оператор положительн х дифференциальн оператор п положительн р оператор х положительн дифференциальн
1661,р л е г н н т г х п е ф т х р г ф т х п м
