,0
3059,соотношен элемент т алгебр ах моном вопрос пуст некотор вид хах алгебр вопрос ах моном элемент пуст некотор вид хах соотношен е ах вопрос хах вид алгебр пуст моном элемент соотношен некотор моном пуст некотор алгебр ах хах вопрос элемент соотношен вид
3060,решен сист задач г кош имеет оператор вид так уравнен задач имеет кош решен п сист уравнен оператор так т уравнен задач решен г кош оператор имеет вид так сист кош уравнен задач решен п так имеет оператор т
3061,нул функц решен векторн симметричн собствен краев сил котор задач матриц услов границ функц оператор явля задач краев нул равн числ матриц решен услов уравнен интегра част задач исходн област векторн матриц услов нул границ функц решен краев уравнен симметричн сил решен границ интегра числ задач услов матриц функц краев уравнен нул
3062,т след е пространств см ешп функц класс предложен гармоническ распределен случа е гармоническ след т некотор см класс ешп распределен функц пространств мп след пуст функц ешп анализ пространств см класс гармоническ предложен распределен случа класс ешп функц предложен случа след пространств см гармоническ распределен мп р
3063,е о разрешим многообраз оператор м пуст нормальн форм замкнут х форм пуст многообраз оператор р т разрешим пространств нормальн м пуст т пространств оператор е нормальн разрешим форм многообраз разрешим пространств замкнут т оператор р е пуст нормальн форм
3064,автоморфизм групп порожда внутрен подгрупп жестк φ класс точност коксетер тип диаграмм систем пуст диаграмм след коксетер жестк систем инволюц групп автоморфизм тип подгрупп точност пуст сопряжен люб групп жестк сопряжен пуст диаграмм точност порожда коксетер инволюц автоморфизм тип подгрупп внутрен φ автоморфизм групп подгрупп сопряжен люб инволюц точност коксетер тип диаграмм жестк систем пуст внутрен
3065,функц тг услов свертк отобража работ теорем уравнен сюръективн цфэт област пространств регулярн услов выполн отобража вполн случа теорем област оператор теорем област работ тг пространств следств метод некотор сопряжен доказательств цфэт функц некотор выполн множеств оператор доказательств работ област ь пуст регулярн е
3066,м функц граничн пространств п аналитическ некотор явля голоморфн элемент компакт е т г гиперфункц значен функц явля област пространств гармоническ граничн множеств е окрестн продолжен голоморфн пространств явля г функц област г множеств значен гармоническ голоморфн аналитическ продолжен граничн област функц п
3067,п пространств уравнен задач функц услов след лемм фи непрерывн функц фи ф услов уравнен след г пространств лемм вид след услов функц доказательств фи уравнен п лемм вид фи вид услов уравнен пространств п функц г лемм след задач
3068,пуст конформн многообраз м групп явля р точк преобразован сло гомотет р преобразован гомотет пуст м точк групп многообраз сло явля будущ множеств кажд м многообраз явля преобразован конформн точк сло групп множеств групп множеств будущ точк многообраз явля р сло преобразован гомотет
3069,0
3070,г оператор м разложен гахов символ пуст разложен пуст гахов оператор т символ символ разложен м оператор гахов пуст символ оператор гахов е разложен пуст т
3071,бесконечн инволюц част конечн некотор локальн сопряжен рассмотр предполож го групп облада подгрупп пуст услов факторгрупп част очевидн доказательств бесконечн элемент полн свойств групп конечн явля подгрупп го облада инволюц диэдр част рассмотр содержа случа так ввид лемм точк порядк лемм силовск групп периодическ инволюц некотор сопряжен бипримитивн порядк имеет ввид част полн индекс
3072,удовлетворя пространств подоб квазиконформн отображен х пуст прям л д удовлетворя люб отображен х пуст подоб пространств так отображен е так прям подоб г неравенств пуст пространств неравенств пространств пуст квазиконформн м люб отображен л г
3073,п оценк перемен л г услов справедлив так оценк перемен р е услов п так справедлив справедлив е оценк п услов т перемен так услов х т п оценк перемен справедлив так
3074,абелев вполн эффективн пар групп чисел разложим элемент шаг пуст так чисел групп абелев шаг вполн пар разложим пуст эффективн так элемент разложим шаг е групп вполн эффективн чисел пар пуст элемент абелев шаг элемент чисел групп вполн разложим эффективн пуст абелев пар г
3075,фрейм сгустк модел прав выполня буд метаперемен перемен логик элемент вывод свойств кажд означиван логик элемент формул кажд свойств множеств люб пуст котор модел фрейм прав сгустк означиван определен пуст метаперемен свойств вывод кажд явля формул модел логик фрейм прав сгустк элемент множеств свойств метаперемен явля прав элемент означиван сгустк перемен выполня логик пуст модел фрейм
3076,т морфизм множеств категор произвольн абелев мал групп люб симплекс называ когомолог а абелев называ категор равн произвольн т отображен функтор морфизм люб г значен мал равн функтор объект категор морфизм групп категор симплекс пуст кажд ах е мал когомолог котор функтор морфизм
3077,групп п индекс доказа подгрупп термин ргрупп ступен нильпотентн элемент автоморфизм нильпотентн индекс элемент групп ргрупп теорем подгрупп ступен термин огранич котор ступен огранич ограничен элемент хьюз числ доказа разрешим групп подгрупп нильпотентн ступен термин индекс нильпотентн групп подгрупп элемент котор числ разрешим
3078,граничн услов обострен задач р так функц услов граничн обострен задач функц так задач услов граничн обострен функц так г граничн так услов задач обострен функц
3079,явля теорем алгебр пуст х многообраз групп конгруэнц л предложен групп предложен конгруэнц явля п многообраз х алгебр теорем пуст пуст п е конгруэнц многообраз групп алгебр явля предложен теорем алгебр пуст п г многообраз конгруэнц явля групп предложен теорем
3080,групп образ фуксов числ поверхн г пол так род см сигнатур риманов доказательств числ род так групп фуксов риманов поверхн сигнатур оценк автоморфизм пол определен групп фуксов минимальн риманов треугольн неарифметическ так поверхн сигнатур числ пол пол оценк доказательств автоморфизм арифметическ так сигнатур групп поверхн риманов числ
3081,функц област точк случа угл множеств услов либ зо голоморфн голоморфн случа зо точк либ угл множеств услов функц област услов функц зо случа множеств точк област м угл либ голоморфн функц точк случа либ множеств област угл услов зо м голоморфн
3082,уравнен имеет мг х функц решен пространств случа регулярн удовлетворя значен удовлетворя мг уравнен функц решен пространств е случа имеет регулярн так функц случа решен имеет уравнен мг пространств регулярн удовлетворя так значен п регулярн удовлетворя пространств уравнен функц мг решен случа имеет
3083,услов задач е решен метод уравнен обратн оператор функц ньютон теорем решен теорем обратн функц задач уравнен услов оператор ньютон метод уравнен услов функц задач обратн оператор теорем ньютон решен метод оператор обратн уравнен теорем метод задач решен услов е функц ньютон
3084,вопрос либ выводим случа вывод неизвестн применен буд имеет поформул ф хорновск известн логическ услов неизвестн котор процесс вершин люб исчислен пппроцесс формул поформул формул некотор перемен случа котор уравнен баз пуст пппроцесс доказательств поформул частичн поформул вершин буд услов котор явля конъюнкт формул применен имеет некотор случа
3085,е отображен функц класс отображен функц класс функц отображен класс функц отображен класс
3086,н так вес регулярн транзитивн работ дистанцион кодов выбор образ числ след свойств двоичн регулярн пуст координат так дистанцион явля числ кажд код кодов слов вес препарат слов называ длин явля свойств выкалыван вес люб двоичн дистанцион регулярн расстоян равн след код длин препарат завис кажд свойств расстоян так образ слов кодов числ транзитивн вес
3087,элемент д люб м меньш подалгебр свободн алфав правильн прям е одн элемент соотношен векторн подалгебр слов алгебр лиев пуст степен подслов линейн свободн правильн пуст котор п композиц содерж свободн сумм подалгебр одн степен прям старш пуст множеств подслов меньш подалгебр х лиев сумм котор
3088,пространств семейств евклидов гиперплоск пересека вектор п точк формул обращен люб преобразован пуст л пространств формул обращен евклидов вполн явн размерн сфер точк е гиперплоск точк вектор р пространств лучев сфер размерн формул преобразован геодезическ точк пространств гиперплоск пуст формул преобразован вектор обращен размерн г р
3089,е пространств компактн мер функц пуст правильн пуст правильн мер пространств функц компактн е мер пространств пуст компактн правильн функц мер правильн пространств функц пуст компактн
3090,г перв функц уравнен рима формул услов рима уравнен функц л перв услов формул уравнен функц х перв формул услов рима уравнен формул функц у х рима перв услов
3091,свойств каркас пуст решетк г подмножеств атом зам числ услов ср элемент ср атом доказательств определен ер решетк числ услов элемент пуст каркас л числ каркас решетк выполня зам ер услов ср г люб некотор га равенств ср люб ер работ услов пуст определен числ п
3092,т задач област функц систем г решен уз точк формул уз формул област т г функц систем задач решен точк т е област точк функц задач систем решен уз формул функц систем задач х област уз решен точк формул
3093,л так элемент отсюд существ ф групп пуст однородн подгрупп групп элемент г систем модел ф покаж пуст однородн подгрупп пуст существ автоморфизм отсюд групп элемент г д однородн однородн систем част существ элемент групп пуст р так
3094,х так шар функц компакт точк г критическ центр гс е шар радиус функц критическ гс точк р компакт центр точк шар компакт центр функц гс е так критическ множеств шар гс так центр точк х функц вписа критическ множеств компакт
3095,г существ полигон элемент так модельн люб регулярн множеств класс явля полигон люб п существ е регулярн класс множеств моноид элемент х множеств явля люб класс моноид существ модельн полигон регулярн люб регулярн явля множеств полигон х класс моноид элемент так
3096,булев г люб пуст алгебр вложим лемм некотор многообраз решетк скелет вложен т алгебр лемм пуст множеств вложен булев люб вложим многообраз решетк лемм решетк многообраз вложен неравенств люб множеств алгебр булев е вложим скелет алгебр неравенств вложим мест булев люб решетк многообраз лемм пуст вложен
3097,класс модел числ люб последовательн тип теор тождеств конечн множеств счетн эквивалентн кейслер конечн люб класс тип счетн изоморфизм кейслер модел теор тождеств числ множеств последовательн полн конечн эквивалентн изоморфизм тождеств котор кейслер модел люб теор тип последовательн счетн так услов теор эквивалентн модел конечн люб тип тождеств счетн множеств последовательн числ
3098,предложен произведен скручен п групп алгебр действ элемент получа услов алгебр п элемент получа групп произведен скручен н действ предложен услов произведен скручен г получа алгебр предложен элемент групп п действ услов групп скручен действ произведен н алгебр элемент предложен услов получа
3099,нелинейн х уравнен функц решен точн систем вид решен нелинейн х уравнен функц точн систем вид уравнен систем нелинейн функц вид решен точн х уравнен решен систем функц нелинейн г точн вид х
3100,равенств матриц построен п решен веществен услов уравнен характеристик тэтафункц тэтафункц веществен равенств построен решен уравнен п услов матриц характеристик решен уравнен построен услов равенств матриц т веществен характеристик тэтафункц п характеристик веществен уравнен равенств матриц решен построен услов тэтафункц
3101,интегральн ядр метод котор кош уравнен решен функц задач вид ограничен ряд оценк задач метод построен интегральн ядр уравнен решен функц нейма ряд г оценк уравнен кош вид функц решен ряд задач ограничен котор нейма оценк функц нейма г интегральн уравнен решен задач ряд оценк ограничен котор вид т
3102,г формул област функц е е област функц формул т функц област формул г т функц област р формул
3103,представлен числ клостерма х формул форм чисел п квадратичн о тип формул тип форм чисел числ т представлен квадратичн клостерма п чисел форм клостерма т формул представлен квадратичн числ г т представлен форм формул чисел клостерма квадратичн тип
3104,п р услов неравенств задач решен краев уравнен задач услов х неравенств п уравнен решен краев решен г задач неравенств услов уравнен краев задач краев р услов уравнен г неравенств ф решен
3105,т оценк х функц уравнен получ преобразован задач интегральн част функц част уравнен след получ р задач х преобразован интегральн оценк преобразован интегральн х задач получ функц уравнен оценк част задач г т функц уравнен преобразован получ част оценк интегральн
3106,р задач функц област услов некотор решен след так уравнен оператор теорем уравнен доказательств решен след оператор задач так функц р теорем некотор оценк решен существ област теорем след оценк дирихл уравнен оператор задач функц нейма пуст оператор след дирихл решен уравнен задач теорем
3107,обратн функц задач решен п решен задач обратн п функц задач обратн решен функц п задач решен обратн л функц
3108,логик фрейм алгебр множеств базис означиван явля формул φ прав допустим вывод φ след конечн допустим алгебр существ перемен формул модел прав логик прав истин логик модальн свойств так элемент φ базис алгебр существ формул модел допустим прав модел явля получ модальн элемент люб свойств φ логик допустим вывод фрейм
3109,функц решен услов начальн пространств задач дан обобщен газ уравнен обобщен уравнен решен функц задач начальн услов дан пространств газ услов дан функц уравнен начальн решен задач пространств обобщен газ начальн дан задач функц г решен услов пространств обобщен газ
3110,связн пространств выпукл прям компакт пуст срп диск произвольн линейн множеств област точк диск предложен множеств прям точк пространств свыпукл срп проективн выпукл линейн област компакт линейн множеств выпукл функц прям диск свыпукл срп точк област пуст компакт комплексн содерж линейн компакт внутрен срп диск множеств выпукл точк свыпукл област прям
3111,област мер класс слаб последовательн г семейств свойств класс мер непрерывн свойств слаб семейств х област функц т последовательн слаб семейств мер непрерывн свойств област семейств свойств слаб регулярн мер х функц т област
